{
  "schema_version": "1.0.0",
  "record_type": "event",
  "id": "gls:event:6d619fa0-d43b-44b1-b473-38a05b178b3a",
  "occurred_at": "2026-08-02T00:12:29+07:00",
  "recorded_at": "2026-08-02T00:12:29+07:00",
  "immutable": true,
  "entry_type": "initiative_completed",
  "thread": {
    "id": "gls:thread:god-questions-infrastructure",
    "name": "God Questions Library infrastructure",
    "kind": "research"
  },
  "status": "completed",
  "title": "God Questions Observatory and GQ-009 released",
  "summary": "The Great Library now exposes a seven-question God Questions Observatory and a richer reusable question-program contract, with the infrastructure itself recorded as GQ-009 and selected through immutable Releases and Whole Library V30.",
  "intent": "Close the first infrastructure dogfood loop using existing research: make question state and decision relevance visible, keep evidence and execution independently owned, and preserve exact public release lineage.",
  "reasoning": [
    "The meta-question forced the shared contract to express the decision, success, falsifier, evidence-gap, and watch-trigger fields that a living research program needs.",
    "The generated Observatory reuses Question Works and Snapshot projection rather than creating a parallel dashboard database.",
    "GQ-009 remains researching and its first Release is explicitly a metadata seed, so the infrastructure does not mistake its own implementation for an accepted answer."
  ],
  "changes": [
    {
      "kind": "commit",
      "reference": "https://github.com/Lordsisodia/great-library-of-siso/commit/d16ac75d98849dfb62e2e684e3d02b65132a25c5",
      "summary": "Published GQ-009, the extended research contract, generated Observatory, four contract fixtures, and public-safe site projection."
    },
    {
      "kind": "registry_record",
      "reference": "gls:release:07f984fa-af0a-422a-9103-6e34a2ac6dbd",
      "summary": "Pinned the exact public God Questions infrastructure implementation as Great Library release 0.8.0+d16ac75."
    },
    {
      "kind": "registry_record",
      "reference": "gls:snapshot:fb10d973-8a24-44c7-8fed-b22e7d227b5d",
      "summary": "Selected the exact implementation release and GQ-009 metadata seed through Whole Library V30."
    },
    {
      "kind": "test",
      "reference": "repo-check:god-questions-infrastructure:d16ac75",
      "summary": "Passed the complete registry, generated-site, identity, and publication-safety gate."
    }
  ],
  "scope": {
    "work_ids": [
      "gls:work:9b18cc64-7d5e-4f30-b63d-a0ec30c1f7e1",
      "gls:work:2fa08dac-937a-44d3-a547-f16ac28c4e25",
      "gls:work:3e220d53-cd95-4e28-922e-5018e808ee92"
    ],
    "release_ids": [
      "gls:release:3aff8b95-f2b6-4ca6-b162-3543ba4eda39",
      "gls:release:07f984fa-af0a-422a-9103-6e34a2ac6dbd"
    ],
    "snapshot_ids": [
      "gls:snapshot:1c0e97ef-1327-4c6c-bebc-0af7f56f2ed4",
      "gls:snapshot:fb10d973-8a24-44c7-8fed-b22e7d227b5d"
    ],
    "repository_urls": [
      "https://github.com/Lordsisodia/great-library-of-siso"
    ]
  },
  "coordination": {
    "owner": "Great Library God Questions infrastructure maintainer",
    "branch": "codex/god-questions-infrastructure-20260802",
    "reserved_paths": []
  },
  "visibility": "public",
  "predecessor_event_id": "gls:event:60bd8d34-5531-4288-a4f9-49c15e0d3faa",
  "evidence": [
    {
      "kind": "public_locator",
      "reference": "https://github.com/Lordsisodia/great-library-of-siso/commit/d16ac75d98849dfb62e2e684e3d02b65132a25c5",
      "observed_at": "2026-08-02",
      "summary": "The exact implementation commit resolves publicly from the canonical repository."
    },
    {
      "kind": "registry_validation",
      "reference": "repo-check:god-questions-infrastructure:d16ac75",
      "observed_at": "2026-08-02",
      "summary": "Immutable history, ten promotion fixtures, ten intelligence fixtures, four research-contract fixtures, registry validation, generated-site links and identity, and publication safety all passed."
    }
  ],
  "next_actions": [
    "Use the substantial existing GQ-001, GQ-002, and CRM research to populate the richer program fields rather than generating replacement research.",
    "Connect the first question-addressable Foundry or Knowledge export through ignored staging and evidence-owned locators.",
    "Perform a visual browser pass when an in-app or connected browser surface is available; this session had no browser instance."
  ]
}
