{
  "schema_version": "1.0.0",
  "record_type": "event",
  "id": "gls:event:89fb96df-a5a6-4dd5-bcd5-a53a3619a8e7",
  "occurred_at": "2026-08-02T00:03:09+07:00",
  "recorded_at": "2026-08-02T00:03:09+07:00",
  "immutable": true,
  "entry_type": "initiative_started",
  "thread": {
    "id": "gls:thread:god-questions-infrastructure",
    "name": "God Questions Library infrastructure",
    "kind": "research"
  },
  "status": "active",
  "title": "God Questions infrastructure dogfood started",
  "summary": "A Library maintainer reserved the question contract, portfolio projection, tests, and registry records needed to make the existing God Questions corpus visible as a living research system.",
  "intent": "Dogfood the existing Frontier Questions model by adding the Great Library's own God Questions infrastructure as a standing question and exposing decision, falsifier, evidence-gap, watch-trigger, and portfolio state without duplicating Foundry, Knowledge, Evidence Engines, or runtime ownership.",
  "reasoning": [
    "Existing research should exercise the infrastructure rather than be rediscovered through speculative agent probes.",
    "The current Research page proves stable identity but does not yet expose enough program state to operate a world-class question portfolio.",
    "A meta-question about the God Questions system is the smallest honest dogfood case because weaknesses in the question contract become immediately visible in the system that records it."
  ],
  "changes": [
    {
      "kind": "coordination",
      "reference": "gls:thread:god-questions-infrastructure",
      "summary": "Reserved a non-overlapping lane for GQ-009 and the shared question-program projection before implementation."
    }
  ],
  "scope": {
    "work_ids": [
      "gls:work:9b18cc64-7d5e-4f30-b63d-a0ec30c1f7e1",
      "gls:work:2fa08dac-937a-44d3-a547-f16ac28c4e25"
    ],
    "repository_urls": [
      "https://github.com/Lordsisodia/great-library-of-siso"
    ]
  },
  "coordination": {
    "owner": "Great Library God Questions infrastructure maintainer",
    "branch": "codex/god-questions-infrastructure-20260802",
    "reserved_paths": [
      "schemas/work.schema.json",
      "registry/works/frontier-question-gq-009.json",
      "registry/releases/frontier-question-gq-009-seed.json",
      "registry/snapshots/whole-library-v29.json",
      "registry/events/2026-08-02-god-questions-infrastructure-*.json",
      "scripts/build.mjs",
      "scripts/check-site.mjs",
      "scripts/verify.mjs",
      "tests/research-contract.test.mjs",
      "README.md",
      "CURRENT_STATE.md",
      "site/"
    ]
  },
  "visibility": "public",
  "evidence": [
    {
      "kind": "documentation",
      "reference": "user-intent:god-questions-infrastructure:2026-08-02",
      "observed_at": "2026-08-02",
      "summary": "The requested next move is to prioritize reusable God Questions infrastructure, reuse the substantial existing research corpus, and add the Library infrastructure itself as a dogfood God Question."
    }
  ],
  "next_actions": [
    "Add GQ-009 as a publication-safe Question Work and metadata-seed Release.",
    "Expose reusable program fields and a visible question-portfolio projection from the canonical registry.",
    "Verify the contracts and select the new question through a successor whole-Library Snapshot."
  ]
}
