{
  "schema_version": "1.0.0",
  "record_type": "event",
  "id": "gls:event:9b09caed-89b4-4c1e-8829-b58cbddeb115",
  "occurred_at": "2026-08-02T05:02:31+07:00",
  "recorded_at": "2026-08-02T05:02:31+07:00",
  "immutable": true,
  "entry_type": "initiative_started",
  "thread": {
    "id": "gls:thread:c309e9d3-2d27-470c-b99f-c7a0ac469151",
    "name": "Public estate reconciliation",
    "kind": "initiative"
  },
  "status": "active",
  "title": "Public estate reconciliation started",
  "summary": "A Great Library maintainer reserved a bounded successor that will turn a reviewed four-repository public candidate cohort into explicit link-existing, no-change, or deferred outcomes without importing private estate evidence or creating duplicate Works.",
  "intent": "Publish the smallest public-safe model and GQ-009 learning successor that make the observation-to-Library decision path reconstructable while preserving owner, rights, evidence, runtime, and registry authority boundaries.",
  "reasoning": [
    "The existing Work, Release, Snapshot, Event, and question-program spine can express reconciliation learning without a second registry, new Work family, or Source Inventory campaign.",
    "Two candidates already resolve to exact existing Work and Release lineage, one is older evidence under existing runtime and warehouse lineage, and one must remain deferred for owner and license review.",
    "Repository visibility and administrative access identify a review route; they do not establish reuse rights, independent Work value, release readiness, or permission to mutate source."
  ],
  "changes": [
    {
      "kind": "coordination",
      "reference": "gls:thread:c309e9d3-2d27-470c-b99f-c7a0ac469151",
      "summary": "Reserved only the authored reconciliation model, GQ-009 metadata successor, immutable publication lineage, deterministic generation checks, and generated site surfaces."
    }
  ],
  "scope": {
    "work_ids": [
      "gls:work:9b18cc64-7d5e-4f30-b63d-a0ec30c1f7e1",
      "gls:work:3e220d53-cd95-4e28-922e-5018e808ee92",
      "gls:work:54a52e52-dfbd-4922-8c04-ec02f7fae943",
      "gls:work:b9196c61-901f-4105-93d9-899876d17016",
      "gls:work:b584bbf7-acde-46a2-b33e-e430ee1df224",
      "gls:work:ee26c795-ac31-4f31-bb8f-e54dbc515bae"
    ],
    "repository_urls": [
      "https://github.com/Lordsisodia/great-library-of-siso"
    ]
  },
  "coordination": {
    "owner": "Great Library estate reconciliation Sol maintainer",
    "branch": "codex/estate-reconciliation-20260802",
    "reserved_paths": [
      "docs/estate-reconciliation.html",
      "docs/README.md",
      "CURRENT_STATE.md",
      "registry/works/frontier-question-gq-009.json",
      "registry/releases/frontier-question-gq-009-estate-reconciliation-v1.json",
      "registry/releases/great-library-estate-reconciliation-*.json",
      "registry/snapshots/whole-library-v33.json",
      "registry/events/2026-08-02-estate-reconciliation-*.json",
      "scripts/build.mjs",
      "scripts/check-site.mjs",
      "tests/god-questions-infrastructure.test.mjs",
      "site/"
    ]
  },
  "visibility": "public",
  "evidence": [
    {
      "kind": "source_review",
      "reference": "owner-review:estate-reconciliation:2026-08-02",
      "observed_at": "2026-08-02",
      "summary": "A bounded owner-preservation review approved Library-only reconciliation for four public repository revisions and authorized no source-repository mutation."
    },
    {
      "kind": "release_receipt",
      "reference": "https://github.com/Lordsisodia/great-library-of-siso/commit/c6e05e8e748239b2edcc581b5911b7cccd30eb2f",
      "observed_at": "2026-08-02",
      "summary": "The exact starting revision contains the completed God Questions infrastructure, selected GQ-009 program lineage, and zero active Library initiatives."
    }
  ],
  "next_actions": [
    "Publish this reservation on canonical main before substantive edits.",
    "Author and verify the public reconciliation model and the GQ-009 no-change learning successor without creating a Work or Source Inventory.",
    "Add immutable Release, Snapshot, and completion Event successors, deploy the generated site, and verify zero active initiatives."
  ]
}
